{
  "contract": {"name": "EO_GE_NORMALIZED_DATA_CONTRACT", "version": "1.0", "schema_version": "1.0"},
  "identity": {"id": "SENTINEL1_S1GRD_20260904T171002_T13RFL_v1", "version": "v1"},
  "data_class": "OBSERVATION",
  "source": {"provider": "ESA", "mission": "Sentinel-1", "platform": "Sentinel-1A", "instrument": "SAR-C", "collection": "S1GRD"},
  "product": {"product": "S1GRD", "product_type": "Ground Range Detected", "processing_level": "L1", "version": "1"},
  "acquisition": {"start_time": "2026-09-04T17:10:02Z", "end_time": "2026-09-04T17:10:05Z", "observation_time": "2026-09-04T17:10:02Z"},
  "temporal": {"temporal_resolution": "P6D"},
  "spatial": {"crs": "EPSG:32613", "native_crs": "EPSG:32613", "epsg": 32613, "bounds": [400000.0, 2700000.0, 500000.0, 2800000.0], "geometry_type": "Polygon", "resolution": {"x": 10.0, "y": 10.0, "unit": "m"}, "tile": "T13RFL"},
  "processing": {"processing_type": "NATIVE", "transformations": []},
  "data": {
    "kind": "raster",
    "raster": {
      "bands": [
        {"name": "VV", "variable": "sigma0_vv", "units": "dB", "dtype": "float32", "nodata": -9999.0},
        {"name": "VH", "variable": "sigma0_vh", "units": "dB", "dtype": "float32", "nodata": -9999.0}
      ],
      "dimensions": {"x": 4000, "y": 4000, "band": 2}
    },
    "storage": {"format": "COG", "asset_id": "SENTINEL1_S1GRD_20260904T171002_T13RFL_v1"}
  },
  "quality": {"status": "AVAILABLE"},
  "provenance": {"provider": "ESA", "source_url": "https://dataspace.copernicus.eu", "original_product": "S1A_IW_GRDH_...", "license": "CC-BY-4.0", "checksum": "sha256:def456"}
}
